A1: Bloodmoon | B1: Rank | D1: Howlurs | E1: Rank | G1: Tribeless | H1: Rank
A2: Da'bou | B2: Bloodmoon Nob | D2: Gor'bladz | E2: Howling Skulls Nob | G2: Rug'yula | H2: Tribeless Gu'Kigg-r
A3: Ur'Buurzghul | B3: Bloodmoon Nob | D3: Shag'Rajau | E3: Howling Skull Nob | G3: Flu'gulz | H3: Tribeless Gu'Ligz-r
A4: Thrak'Burzum | B4: Martyr Ug'Lusk-r | D4: Gorgt'Gta'Grum | E4: Howler Nob | G4: Urgh'Gok | H4: Tribeless Gu'Lusk-r
A5: Gug'lub | B5: Warboss Guard | D5: Ig'Lug'Nu | E5: Howler Gu'Kigg-r | G5: Drutha | H5: Tribeless Gu'Zult-r
A6: Hav'grim | B6: Devotee Wa'Zult-r | D6: Eichelberbog | E6: Howler Gu'Lusk-r | G6: Bluhg'nag | H6: Tribeless Kigg-r
A7: goglok | B7: Moonie Ug'Nob Gard | D7: Ruuh'nuk | E7: Howler Gu'Lusk-r | G7: Liki Tiki | H7: Tribeless Kigg-r
A8: Mugh'gluck | B8: Moonie Wa'Nob Gard | D8: Vur'Rok | E8: Howler Gu'Lusk-r | G8: Xag'Nar | H8: Tribeless Kigg-r
A9: Lud'rak | B9: Oracle Wa'Ligz'r | D9: Bug'ob'duump | E9: Howler Mojoka | G9: Rik'Ug | H9: Tribeless Lusk-r
A10: Tug'nuut | B10: Seer Ug'Womp-r | D10: Vikk'mar | E10: Howler Pup Gu'Lusk-r | G10: Luba'Trughus | H10: Tribeless Womp-r
A11: Prel | B11: Moonie Durub Bang-r | D11: Cruk'nuk | E11: Howler Pup Gu'Womp-r | G11: Xug'muk | H11: Tribeless Ligz-R
A12: Pok | B12: Bloodmoon Gu'Ligz'r
A13: Gribblegrib | B13: Bloodmoon Gu'ligz-r | D13: Throquat Uzg | E13: Rank | G13: Specialties | H13: Rank
A14: Rug'gur | B14: Bloodmoon Gu'ligz-r | D14: Gra'ook | E14: Sharkuu Throquat Nob | G14: Fulu | H14: Mojokii
A15: Gru'umsh | B15: Bloodmoon Gu'Womp-r | D15: Buu'skr | E15: Blood Kigg-r | G15: Uba'latz | H15: Big Mak-R
A16: Blud'lum | B16: Bloodmoon K'igg-r | D16: Nek'raka | E16: Blood Ligz-r | G16: Kragnagh | H16: Mog'Ob'Goth Mak-R
A17: Kraguk | B17: Bloodmoon Kult-R | D17: Migon | E17: Throquat Ug'ligz-r | G17: Grob | H17: Buorca Stij-r
A18: Shak'rak | B18: Bloodmoon Mojoka | D18: Vu'grug | E18: Throquat Ug'ligz-r | G18: Kor'Lug | H18: Buorca Mak-R
A19: Mak'barz | B19: Bloodmoon Ug'ligz-r | D19: Xiv'er | E19: Brugh Fort Guard | G19: Juurz'nuut | H19: Tala Mak-R
A20: Hitk'Lky | B20: Martyr Gu'Kiggr | D20: Nog'bu | E20: Brugh Wa'Lusk-r | G20: Kabu'fulag | H20: Tala Drum-r
A21: Vrak'Og | B21: Martyr Ug'Kigg-r | D21: Zul'rekka | E21: Uzg'Trughu Kulthu | G21: Yula'bagath | H21: Nubkuu Mak-R
G22: Kabu'Burzum | H22: Nubkuu Bang-r
A23: Thrak Ghaash | B23: Rank | D23: Hedbiter | E23: Rank | G23: Bud'te | H23: Nubkuu Mak-r
A24: Gra'Gra | B24: Ghaashie Lata'Nob | D24: Shog'burz | E24: Hedbiter Nob | G24: Krehk'nag | H24: Nubkuu Mak-r
A25: Bruz'aa | B25: Ghaash Gu'Zult'r | D25: Vrok'Nuk | E25: Hedbiter Nob | G25: Sylf | H25: Nubkuu Mak-r
A26: Kriza | B26: Ghaashi Ug'ligz-r | D26: Hosh'Goth | E26: Biter Blud'lusk-r | G26: Hvark | H26: Nubkuu Mak-r
A27: Xensek | B27: Ghaashie Fort Guard | D27: Paw'twig | E27: Blood Womp-r
A28: Raka'Ja | B28: Ghaashie Gu'Kigg-r | D28: Ruk'zmazher | E28: Hedbiter Nob Gard | G28: Gruntee | H28: Rank
A29: Gurukk | B29: Ghaashie Gu'Womp'r | D29: Fal'ua | E29: Biter Ug'Lusk'r | G29: Hazog | H29: Gruntee Ligz-r
A30: Fidgit | B30: Ghaashie Mojoka | D30: Lil'flur | E30: Shak'goth Hedbiter | G30: Kobul | H30: Gruntee Ligz-r
A31: Gan'Tungi | B31: Ghaashie Ug'Kigg-r | D31: Rag'rabu | E31: Bitur Zult-R | G31: Vruk | H31: Gruntee Ligz-r
A32: Ki'la | B32: Ghaashie Ug'Womp-r | D32: Seg'Pu | E32: Hedbiter Gu'Kigg-r | G32: Guh | H32: Gruntee Lusk-r
A33: Mor'Goth | B33: Ghaashie Ug'Womp-r | D33: Maugrim | E33: Hedbiter Gu'Lusk-r | G33: Skwa'bur | H33: Gruntee Lusk-r
A34: Ghul'Ruk | B34: Ghaashie Wa'lusk-r | D34: Wub'Tad | E34: Hedbiter Gu'lusk-r | G34: Ug'Luk | H34: Gruntee Lusk-r
A35: Wud'Gub | B35: Ghaashie Warboss | D35: Kuig'aluge | E35: Hedbiter Gu'Womp-r | G35: Untja | H35: Gruntee Lusk-r
D36: Rok'goth | E36: Hedbiter Mojoka | G36: Zul'Gluk | H36: Gruntee Lusk-r
D37: Olodagh | E37: Tribless Gu'Womp-r | G37: Bal'Rog | H37: Gruntee Womp-r
A38: Shrinku | B38: Rank | G38: Fripig | H38: Gruntee Womp-r
A39: Xug'gug | B39: Blood Zult-r | G39: Gah | H39: Gruntee Womp-r
A40: Vikk'Deruk | B40: Srinkhu Gu'ligz-r | G40: Hetynk | H40: Gruntee Womp-r
A41: Tr'Pot | B41: Srinkhu Gu'Womp-r | G41: Rar'fu | H41: Gruntee Womp-r
A42: Shistrag | B42: Srinkhu Kulthu | G42: Dru'Gu | H42: Gruntee Zult-r
A43: Grak'Shogum | B43: Srinkhu Warboss'Gard | G43: Lug'Krug | H43: Gruntee Zult-r
G44: Og'Knuk'Guk | H44: Gruntee Zult-r
G45: Shabu | H45: Gruntee Zult-r

A1: Historical | B1: APR06 | C1: AUG18 | D1: DEC31 | E1: MAY31 | F1: JUL12 | G1: OCT15
A2: Moonies | B2: 18 | C2: 25 | D2: 26 | E2: 21 | F2: 22 | G2: 20
A3: Ghaashies | B3: 18 | C3: 19 | D3: 19 | E3: 16 | F3: 13 | G3: 12
A4: Howlurs | B4: 19 | C4: 18 | D4: 13 | E4: 9 | F4: 6 | G4: 10
A5: Quatties | B5: 20 | C5: 24 | D5: 21 | E5: 13 | F5: 8 | G5: 8
A6: Shrinkus | B6: 13 | C6: 15 | D6: 13 | E6: 11 | F6: 6 | G6: 5
A7: Biturs | B7: 17 | C7: 22 | D7: 19 | E7: 19 | F7: 15 | G7: 14
A9: Tribeless | B9: 25 | C9: 23 | D9: 21 | E9: 20 | F9: 17 | G9: 10
A10: Specialties | B10: 19 | C10: 19 | D10: 17 | E10: 21 | F10: 22 | G10: 13
A11: Gruntees | B11: 100 | C11: 82 | D11: 68 | E11: 57 | F11: 43 | G11: 17
A13: Tribed | B13: =SUM(B2:B7) -> 105 | C13: =SUM(C2:C7) -> 123 | D13: =SUM(D2:D7) -> 111 | E13: =SUM(D2:D7) -> 89 | F13: =SUM(D2:D7) -> 70 | G13: =SUM(D2:D7) -> 69
A14: Un-tribed | B14: =SUM(B9:B11) -> 144 | C14: =SUM(C9:C11) -> 124 | D14: =SUM(D9:D11) -> 106 | E14: =SUM(D9:D11) -> 98 | F14: =SUM(D9:D11) -> 82 | G14: =SUM(D9:D11) -> 40
A15: Totals | B15: =SUM(B13:B14) -> 249 | C15: =SUM(C13:C14) -> 247 | D15: =SUM(D13:D14) -> 217 | E15: =SUM(D13:D14) -> 187 | F15: =SUM(D13:D14) -> 152 | G15: =SUM(D13:D14) -> 109
A17: Tribed Avg. | B17: =AVERAGE(B2:B7) -> 17.5 | C17: =AVERAGE(C2:C7) -> 20.5 | D17: =AVERAGE(D2:D7) -> 18.5 | E17: =AVERAGE(D2:D7) -> 14.8 | F17: =AVERAGE(D2:D7) -> 11.7 | G17: =AVERAGE(D2:D7) -> 11.5
A18: Tribed % | B18: =B13/B15 -> 0.42168674698795183 | C18: =C13/C15 -> 0.49797570850202427 | D18: =D13/D15 -> 0.51152073732718895 | E18: =D13/D15 -> 0.51152073732718895 | F18: =D13/D15 -> 0.51152073732718895 | G18: =D13/D15 -> 0.51152073732718895