A1: Bloodmoon | B1: Rank | D1: Hedbiter | E1: Rank | G1: Gruntee | H1: Rank
A2: Da'bou | B2: Bloodmoon Nob | D2: Vrok'Nuk | E2: Head Biter Nob | G2: Thug Nok | H2: Gruntee K'igg-r
A3: Ur'Buurzghul | B3: Bloodmoon Nob | D3: Shog'burz | E3: HedBiter Nob | G3: Buh'Jarg | H3: Gruntee Kigg'r
A4: UrGlutz | B4: Bloodmoon Nob | D4: Uba'latz | E4: Pukelin Big Mak-R | G4: Du'Draki | H4: Gruntee Kigg'r
A5: Hitk'Lky | B5: Martyr Nob Guard | D5: Lil'flur | E5: Shak'Goth Mak-r | G5: Fauth'Glob | H5: Gruntee Kigg'r
A6: Prel | B6: Moonie Durub Forg-R | D6: Hosh'Goth | E6: Biter Nob Guard | G6: Liki Tiki | H6: Gruntee Kigg'r
A7: Shak'rak | B7: Bloodmoon Mojoka | D7: Paw'twig | E7: Headbiter Nob Guard | G7: Raka'Wah | H7: Gruntee Kigg'r
A8: Arguk'Nagzul | B8: Bloodmoon Lusk-r | D8: Ruk'zmazher | E8: Hed Biter Nob Gard | G8: Urk'Tug | H8: Gruntee Kigg'r
A9: Dub'Trub | B9: Martyr Gu'Kigg-R | D9: Uglut'Gloht | E9: Biter Blood Lusk'r | G9: Xoth'Bogh | H9: Gruntee Kigg'r
A10: goglok | B10: Bloodmoon Ug'Lusk-R | D10: Ghazrak | E10: HedBiter Gu'Lusk-R | G10: Galu'rabu | H10: Gruntee Kigg-R
A11: Gribblegrib | B11: BloodMoon Gu'Ligz'r | D11: Gru'Thok | E11: Hedbiter Gu'Lusk-R | G11: Krug'kug | H11: Gruntee Kigg-R
A12: Gug'lub | B12: Bloodmoon Gu'Womp-R | D12: Kuig'aluge | E12: Hedbiter Gu'Womp-R
A13: Hav'grim | B13: Devotee Ug'Zult-R | D13: Magru'goth | E13: Bitur Ug'Womp-R | G13: Frug'Lub | H13: Gruntee Ligz'r
A14: Mak'barz | B14: Bloodmoon Ligz-r | D14: Maugrim | E14: Biter Gu'Lusk'r | G14: Grak'Kash | H14: Gruntee Ligz'r
A15: Morg'Dreg | B15: Preacher Gu'Lusk'r | D15: Mug'zug | E15: Hedbiter Ug Ligz-r | G15: Kobul | H15: Gruntee Ligz'r
A16: Mugh'gluck | B16: Dervish Ug K'igg-r | D16: Rag'rabu | E16: Biter Gu'Zult'r | G16: Muguk | H16: Gruntee Ligz'r
A17: Puguzg'zalu | B17: Blud'Mojoka | D17: Rok'goth | E17: Head Biter Mojoka | G17: Urg'Lok | H17: Gruntee Ligz'r
A18: Skar'lusk | B18: Bloodmoon Gu Lusk-r | D18: Seg'Pu | E18: HedBiter Gu'K'igg-R | G18: Darg'Bry | H18: Gruntee Ligz-r
A19: Throqu'Mog | B19: Bloodmoon Gu Ligz-r | D19: Wub'Tad | E19: Pukeling Gu Lusk-r | G19: Dlum'Er'Gult | H19: Gruntee Ligz-r
A20: Tug'Durub | B20: Fanatik Ug'Womp-R | D20: Zig'Zug | E20: HedBiter Ug'Ligz-R | G20: Ghaash'Nak | H20: Gruntee Ligz-r
A21: Tug'nuut | B21: Seer Ug Womp'r | G21: Gla'Har | H21: Gruntee Ligz-r
A22: Vrak'Og | B22: Bloodmoon Gu K'igg-r | G22: Prak'mat | H22: Gruntee Ligz-r
G23: Ramgugh | H23: Gruntee Ligz-r
A24: Thrak Ghaash | B24: Rank | D24: Throquat Uzg | E24: Rank
A25: Gul'Wur | B25: Thrak'Ghaash Nob | D25: Gor'blatz | E25: Throquat'Uzg Nob | G25: Dub'Tue | H25: Gruntee Lusk'r
A26: Blugba'glub | B26: Sharkuu Nob | D26: Ith'gau'ra | E26: Sharkuu Nob | G26: Glah'Ha | H26: Gruntee Lusk'r
A27: Thulag'Agz | B27: Sharkuu Nob | D27: Buu'skr | E27: Blood Kigg'r | G27: Gurrg | H27: Gruntee Lusk'r
A28: V'rothu | B28: Blood Womp'r | D28: Nek'raka | E28: Blood Ligz'r | G28: Jujok | H28: Gruntee Lusk'r
A29: Zeht'baal | B29: Warboss | D29: Xiv'er | E29: Throquat Fort Guard | G29: Korr'guk | H29: Gruntee Lusk'r
A30: Gurukk | B30: Warboss Guard | D30: Tala'ghaash | E30: Throquat'Uzg Mojoka | G30: Krithnazg | H30: Gruntee Lusk'r
A31: Ki'la | B31: Nob Guard | D31: Kiggru'wuz | E31: Goth'Zagh Wa Lusk'r | G31: Mag'Durknuz | H31: Gruntee Lusk'r
A32: Nub'eer | B32: Clan Drum-R | D32: Xutag | E32: Gund Gu Ligz-r | G32: Oog | H32: Gruntee Lusk'r
A33: Fidgit | B33: Thrak Ghaash Mojoka | D33: Kalraq | E33: Gund Gu Womp'r | G33: Tuuf'magog'og | H33: Gruntee Lusk'r
A34: Gan'Tungi | B34: Ghaashie Ug'Kigg-R | D34: Gra'rok | E34: Gund Womp-R | G34: Vikk'mar | H34: Gruntee Lusk'r
A35: Ghul'Ruk | B35: Ghaashie Wa'Lusk-R | D35: Glub'Bug | E35: Throquat Gu Lusk-r | G35: Vitgut | H35: Gruntee Lusk'r
A36: Glum'Wog | B36: Ghaashie Gu'Womp-R | D36: Vrunk | E36: Brugh Gu Zult'r | G36: Thug'Baal | H36: Gruntee Lusk-R
A37: Gra'Gra | B37: Ghaashie Ug Ligz-r | D37: Nog'bu | E37: Brugh Wa'Lusk'r | G37: Zrug'Lub | H37: Gruntee Lusk-R
A38: Kriza | B38: Ghaashie Ug'Ligz-R | G38: Horuk'Burock | H38: Gruntee Lusk-r
A39: TorGhat | B39: Ghaashie Gu'Kigg-R | G39: Ug'Luk | H39: Gruntee Lusk-r
A40: Wud'Gub | B40: Ghaashie Ug'Womp-R
G41: Cruk'nuk | H41: Gruntee Womp'r
A42: Shrinku | B42: Rank | D42: Howlurs | E42: Rank | G42: Chok'Gash | H42: Gruntee Womp-R
A43: Yub'glubb | B43: Sharkuu Srinkhu Nob | D43: Gor'bladz | E43: Howling Skulls Nob | G43: Fholg'Zemtak | H43: Gruntee Womp-R
A44: Xug'gug | B44: Blood Zult'r | D44: Gorgt'Gta'Grum | E44: Howl'N Wa Lusk-r | G44: Fripig | H44: Gruntee Womp-R
A45: Karne | B45: Srinkhu Wa Kigg'r | D45: Dub'Dub | E45: Howlun Wa'Womp-R | G45: Glub'nuk | H45: Gruntee Womp-R
A46: NefNef | B46: Mojoka | D46: Gund'Shakh | E46: Howl'N Wa Lusk-r | G46: Sharzuuk | H46: Gruntee Womp-R
A47: Mogob Tak | B47: Srinkhu Mojoka | D47: Gup'urz | E47: Shakh'Goth Mak-R | G47: Thrall | H47: Gruntee Womp-R
A48: Shistrag | B48: Kulthu | D48: Eichelberbog | E48: Howler Gu'Lusk-R | G48: Bur'Lyoz | H48: Gruntee Womp-r
A49: Tr'Pot | B49: Srinkhu Gu'Womp'r | D49: K'nis'Lupis | E49: Howler Kigg-R | G49: Kram'Uk'RaaSh | H49: Gruntee Womp-R
A50: Pitgurat | B50: Srinkhu Gu'Womp-R | D50: Ruuh'nuk | E50: Howler Pup Lusk'r
A51: Ghaash'hosh | B51: Srinkhu Ug'Womp-R | D51: Koryug'zuh | E51: Howler Wa Ligz-r | G51: Graagkt | H51: Gruntee Zult'r
A52: Suj'Gash | B52: Srinkhu Gu Ligz-r | G52: Xu'Lag | H52: Gruntee Zult'r
A53: Vikk'Deruk | B53: Srinkhu Ligz-R | G53: Der'Zhul | H53: Gruntee Zult-r
G54: Nug'jhakh | H54: Gruntee Zult-R
A55: Tribeless | B55: Rank | D55: Specialties | E55: Rank | G55: Ba'druuk | H55: Gruntee Zult-r
A56: Grok'ig | B56: Tribeless Kigg-R | D56: Az | E56: Nubkuu Mak-R | G56: Gnurl | H56: Gruntee Zult-r
A57: Buurz'Sarfu | B57: Tribeless K'igg-R | D57: Buub'Rabu | E57: Buorca Mak-R | G57: Gron'teg | H57: Gruntee Zult-r
A58: Rug'yula | B58: Tribeless Kigg'r | D58: Dergu | E58: Tala Mak-R | G58: Gwar'Nusk | H58: Gruntee Zult-r
A59: U'thruka | B59: Tribeless Kigg'r | D59: Grob | E59: Buorca Stij-r | G59: Har'laz | H59: Gruntee Zult-r
A60: Ki'laka | B60: Tribeless Wa K'igg-r | D60: Hvark | E60: Nubkuu Mak-r
A61: Rug'gur | B61: Tribeless Ligz'r | D61: Igg'Shahk | E61: Nubkuu Bang-R | G61: Karsh'garl | H61: Gruntee ???
A62: Xensek | B62: Tribeless Ligz'r | D62: Kabu'fulag | E62: Lil Wuud Kutt-r | G62: Swub'ark | H62: Gruntee ???
A63: Flu'gulz | B63: Tribeless Ligz-r | D63: K'Chomp | E63: Buorca Butch-R | G63: Veng'Trok | H63: Gruntee ???
A64: Ka'mahl | B64: Tribeless Ligz-r | D64: Khug'latz | E64: Nubkuu Butch-r
A65: Spag | B65: Tribeless Ligz-r | D65: Kor'Lug | E65: Buorca Mak-R
A66: Pok | B66: Tribeless Gu Ligz-r | D66: Pug'bu | E66: Nubkuu Mak-R
A67: Xug'muk | B67: Tribeless Wa'Ligz-R | D67: Rukh'Bangr | E67: Buorca Mak-R
A68: Rik'Ug | B68: Tribeless Lusk-R | D68: Ugulaz | E68: Nubkuu Mak-R
A69: Lergy'Hoth | B69: Tribeless Lusk-r | D69: Vluk'pargu | E69: Nubkuu Stich-R
A70: Gurduk | B70: Tribless Ug'Lusk'r | D70: Kraguk | E70: D'vungt
A71: Olodagh | B71: Tribeless Womp'r | D71: Nekruk | E71: Mojoka
A72: Gru'umsh | B72: Tribeless Womp-r | D72: Chi'Gar | E72: Shak's Apprentice
A73: Wuz'Rug | B73: Tribeless Zult'r | D73: Bug'ob'duump | E73: Mojokii
A74: Glosh'Oorg | B74: Tribeless Zult-R | D74: Maru'Maru | E74: Mojokii
A75: Drutha | B75: Tribless Zult'r | D75: Rah'tiki | E75: Mojokii
D76: Blug'Plagz | E76: NefNef's Prentis

A1: Historical | B1: APR06 | C1: AUG18 | D1: DEC31 | E1: MAY31
A2: Moonies | B2: 18 | C2: 25 | D2: 26 | E2: 21
A3: Ghaashies | B3: 18 | C3: 19 | D3: 19 | E3: 16
A4: Howlurs | B4: 19 | C4: 18 | D4: 13 | E4: 9
A5: Quatties | B5: 20 | C5: 24 | D5: 21 | E5: 13
A6: Shrinkus | B6: 13 | C6: 15 | D6: 13 | E6: 11
A7: Biturs | B7: 17 | C7: 22 | D7: 19 | E7: 19
A9: Tribeless | B9: 25 | C9: 23 | D9: 21 | E9: 20
A10: Specialties | B10: 19 | C10: 19 | D10: 17 | E10: 21
A11: Gruntees | B11: 100 | C11: 82 | D11: 68 | E11: 57
A13: Tribed | B13: =SUM(B2:B7) -> 105 | C13: =SUM(C2:C7) -> 123 | D13: =SUM(D2:D7) -> 111 | E13: =SUM(D2:D7) -> 89
A14: Un-tribed | B14: =SUM(B9:B11) -> 144 | C14: =SUM(C9:C11) -> 124 | D14: =SUM(D9:D11) -> 106 | E14: =SUM(D9:D11) -> 98
A15: Totals | B15: =SUM(B13:B14) -> 249 | C15: =SUM(C13:C14) -> 247 | D15: =SUM(D13:D14) -> 217 | E15: =SUM(D13:D14) -> 187
A17: Tribed Avg. | B17: =AVERAGE(B2:B7) -> 17.5 | C17: =AVERAGE(C2:C7) -> 20.5 | D17: =AVERAGE(D2:D7) -> 18.5 | E17: =AVERAGE(D2:D7) -> 14.8
A18: Tribed % | B18: =B13/B15 -> 0.42168674698795183 | C18: =C13/C15 -> 0.49797570850202427 | D18: =D13/D15 -> 0.51152073732718895 | E18: =D13/D15 -> 0.51152073732718895