A1: Thrak Ghaash | B1: Rank | D1: Hedbiter | E1: Rank | G1: Gruntee | H1: Rank
A2: G'Haarg | B2: Thrak Ghaash Nob | D2: Shog'burz | E2: HedBiter Nob | G2: Bagigoth'rok | H2: Gruntee K'igg-R
A3: Thulag'Agz | B3: Sharkuu Nob | D3: Smog'Glog | E3: HedBiter Nob | G3: Galu'rabu | H3: Gruntee K'igg-R
A4: Thunk'glug | B4: Sharkuu Nob | D4: Rel'Gall | E4: HedBiter Nob | G4: Garekk | H4: Gruntee K'igg-R
A5: Nubb'h'k | B5: Ghaashie Womp-R | D5: Thrakat'duump | E5: HedBiter Nob | G5: Grumak | H5: Gruntee K'igg-R
A6: Colv | B6: Thrak Ghaash Mojoka | D6: Vrok'Nuk | E6: Biter Blud K'igg-r | G6: Les'Karg | H6: Gruntee K'igg-R
A7: Fidgit | B7: Thrak Ghaash Mojoka | D7: Uglut'Gloht | E7: Biter Wa'Nob Guard | G7: Nak'gulk | H7: Gruntee K'igg-R
A8: Nub'eer | B8: Clan Drum-R | D8: Rok'goth | E8: HedBiter Mojoka | G8: Klog'Nar | H8: Gruntee K'igg-R
A9: Gan'Tungi | B9: Ghaashie Ug'Kigg-R | D9: Gnashrak | E9: Biter Ug'Lusk-R | G9: Kud'nak | H9: Gruntee K'igg-R
A10: Ghul'Ruk | B10: Ghaashie Wa'Lusk-R | D10: Iggrat | E10: Hedbiter Wa'K'igg-R | G10: Ledurak | H10: Gruntee K'igg-R
A11: Glum'Wog | B11: Ghaashie Womp-R | D11: Kuig'aluge | E11: Hedbiter Gu'Womp-R | G11: Lug'Ruk | H11: Gruntee K'igg-R
A12: Gra'Gra | B12: Ghaashie Gu'Ligz-R | D12: Kul'Gur | E12: Biter Gu'Lusk-R | G12: Nirka | H12: Gruntee K'igg-R
A13: Gul'Wur | B13: Ghaashie Wa'Kigg-R | D13: Paw'twig | E13: Biter Ug'Womp-R | G13: Rum'Raghat | H13: Gruntee K'igg-R
A14: Ki'la | B14: Ghaashie Ug'Womp-R | D14: Ruk'zmazher | E14: Hed Biter Womp-r | G14: T'sogg | H14: Gruntee K'igg-R
A15: Kriza | B15: Ghaashie Ug'Ligz-R | D15: Seg'Pu | E15: HedBiter Gu'K'igg-R | G15: Gash'or | H15: Gruntee K'igg-R
A16: Mor'Goth | B16: Ghaashie Ug'Womp-R | D16: Zig'Zug | E16: HedBiter Ug'Ligz-R | G16: Gu'Wam | H16: Gruntee K'igg-R
A17: Rif Rhud | B17: Ghaashie Wa'Zult-R | D17: Ghazrak | E17: Pukeling Gu'Lusk-R | G17: Lil'ka | H17: Gruntee K'igg-R
A18: Rug'Nuut | B18: Ghaashie Ug'Kigg-R | D18: Gru'Thok | E18: Pukeling Gu'Lusk-R
A19: Wud'Gub | B19: Ghaashie Ug'Womp-R | D19: Zug'Ziggl | E19: Pukeling Ligz-r | G19: Darg'Bry | H19: Gruntee Ligz-R
A20: Zeht'baal | B20: Ghaashie Gu'Kigg-R | D20: Maugrim | E20: Pukling Gu'Lusk-R | G20: Gribblegrib | H20: Gruntee Ligz-R
G21: Nib'garg | H21: Gruntee Ligz-R
A22: Shrinku | B22: Rank | D22: Howlurs | E22: Rank | G22: Pok | H22: Gruntee Ligz-R
A23: Karne | B23: Srinkhu Nob | D23: Gor'bladz | E23: Howling Skulls Nob | G23: Q'raka | H23: Gruntee Ligz-R
A24: Tolglur | B24: Srinkhu Big'Mak-r | D24: Shag'Rajau | E24: Howling Skulls Nob | G24: Spag | H24: Gruntee Ligz-R
A25: Xug'gug | B25: Srinkhu Ug'Zult-R | D25: Ul'Gala'Ka | E25: Sharkuu Howler Nob | G25: Srol'Ghash | H25: Gruntee Ligz-R
A26: Uba'latz | B26: Srinkhu Mak-r | D26: Xugug | E26: Howlur Kult-R | G26: Wak'Gut | H26: Gruntee Ligz-R
A27: Ash'Nazg | B27: Shrinku Ligz-R | D27: Dub'Dub | E27: Howlun Wa'Womp-R | G27: Zi'lug | H27: Gruntee Ligz-R
A28: D-raarg | B28: Srinkhu Lusk-R | D28: Eichelberbog | E28: Howler Gu'Lusk-R | G28: Flu'gulz | H28: Gruntee Ligz-R
A29: Gar'muck | B29: Srinkhu Gu'Kigg-R | D29: Gorgt'Gta'Grum | E29: Howler Lusk-r | G29: Rug'Lig | H29: Gruntee Ligz-R
A30: Ghaash'hosh | B30: Srinkhu Ug'Womp-R | D30: Gum-bunk | E30: Howler Womp-R
A31: Grak'Shogum | B31: Srinkhu Ug'K'igg-R | D31: Ig'Lug'Nu | E31: Howler Gu'K'igg-R | G31: Baldek'Rik | H31: Gruntee Lusk-R
A32: Pitgurat | B32: Srinkhu Gu'Womp-R | D32: K'nis'Lupis | E32: Howler Kigg-R | G32: Durg'Gug | H32: Gruntee Lusk-R
A33: Rogtakh | B33: Srinkhu Zult-R | D33: Koryug'zuh | E33: Howlur Wa'Ligz-R | G33: Ilid'duump | H33: Gruntee Lusk-R
A34: Vikk'Deruk | B34: Srinkhu Ligz-R | D34: Lig'gut | E34: Howler K'igg-r | G34: Krug'bu | H34: Gruntee Lusk-R
A35: Xug'muk | B35: Srinkhu Wa'Ligz-R | D35: Vulg'Ruk | E35: Howler Ug'Womp-R | G35: Lergy'Hoth | H35: Gruntee Lusk-R
G36: Likuku | H36: Gruntee Lusk-R
A37: Throquat Uzg | B37: Rank | D37: Bloodmoon | E37: Rank | G37: Lug'Ragh | H37: Gruntee Lusk-R
A38: Gra'ook | B38: Throquat Uzg Nob | D38: Gromas | E38: Dread Nob | G38: Og'luk | H38: Gruntee Lusk-R
A39: Morgul | B39: Throquat'Uzg Nob | D39: Ur'Buurzghul | E39: Bloodmoon Nob | G39: Ug'Luk | H39: Gruntee Lusk-R
A40: Chug'matlug | B40: Sharkuu Quattie Nob | D40: UrGlutz | E40: Bloodmoon Nob | G40: Wo'Gin | H40: Gruntee Lusk-R
A41: Zuljin'raa | B41: Warboss | D41: Stump'er | E41: Bloodmoon Nob | G41: Fug'uk | H41: Gruntee Lusk-R
A42: Kiggru'wuz | B42: Warboss Guard | D42: Da'bou | E42: Moonie Blud'Lusk-R | G42: Grimz'kull | H42: Gruntee Lusk-R
A43: Buu'skr | B43: Warboss Guard | D43: Lud'rak | E43: Seer Blood Ligz-r | G43: Hosh'Goth | H43: Gruntee Lusk-R
A44: V'rothu | B44: Wa'Gund Nob Guard | D44: Puguzg'zalu | E44: Blud'Mojoka | G44: Klompin'Skullz | H44: Gruntee Lusk-R
A45: Tala'ghaash | B45: Throquat'Uzg Mojoka | D45: Po'kran | E45: Bloodmoon Nob Guard | G45: Smegugh | H45: Gruntee Lusk-R
A46: Zul'rekka | B46: Throquat Kult-R | D46: Shak'rak | E46: Bloodmoon Mojoka | G46: Snog'Gols | H46: Gruntee Lusk-R
A47: Gor'blatz | B47: Brugh Blud'Zult-R | D47: RuszD'igg | E47: Moonie Kult-R | G47: Vor'garag | H47: Gruntee Lusk-R
A48: Xiv'er | B48: Brugh Gu'Ligz-R | D48: H'Gaarg | E48: Moonie Blakrok Mak-R | G48: Zurpi'gig | H48: Gruntee Lusk-R
A49: Kringekt | B49: Brugh Gu'Lusk-R | D49: Prel | E49: Moonie Hel Forj-R
A50: Nog'bu | B50: Brugh Gu'Lusk-R | D50: Arguk'Nagzul | E50: Bloodmoon Lusk-R | G50: Bur'Lyoz | H50: Gruntee Womp-R
A51: Xutag | B51: Gund Gu'Ligz-R | D51: Blud'lum | E51: Martyr Kigg-R | G51: Gurukk | H51: Gruntee Womp-R
A52: Havlig | B52: Gund Ug K'igg-r | D52: Dub'Trub | E52: Martyr Gu'Kigg-R | G52: Iggs'bo | H52: Gruntee Womp-R
A53: Gra'rok | B53: Gund Womp-R | D53: goglok | E53: Bloodmoon Ug'Lusk-R | G53: Jugg'ed | H53: Gruntee Womp-R
A54: Migon | B54: Throquat Gu'Lusk-R | D54: Gug'lub | E54: Bloodmoon Gu'Womp-R | G54: Luba'Buurzkushma | H54: Gruntee Womp-R
A55: GlubGlub | B55: Throquat Ligz-r | D55: Hav'grim | E55: Martyr Ug'Zult-R | G55: Stug'bu | H55: Gruntee Womp-R
A56: Nek'raka | B56: Throquat Ug'Ligz-R | D56: Hitk'Lky | E56: Martyr Gu'K'igg-R | G56: Tor'ug | H56: Gruntee Womp-R
A57: Grugluk | B57: Throquat Wa'K'igg-R | D57: Morg'Dreg | E57: Moonie Preacher | G57: Vloug'Xlug | H57: Gruntee Womp-R
A58: Nag'Kil | B58: Throquat'Uzg Kigg-R | D58: Mugh'gluck | E58: Fanatic Ug'K'igg-R | G58: Zombilge | H58: Gruntee Womp-R
D59: Squabbi | E59: Oracle Wa Ligz-r | G59: Aki'Urdugat. | H59: Gruntee Womp-R
D60: Thraka | E60: Fanatik Gu Lusk-r | G60: Ash'Eye | H60: Gruntee Womp-R
A61: Tribeless | B61: Rank | D61: Throqu'Mog | E61: Moonie Ligz-r | G61: Drio'or | H61: Gruntee Womp-R
A62: Mak'barz | B62: Tribeless Gu'Ligz-R | D62: Tug'Durub | E62: Fanatik Ug'Womp-R | G62: Fripig | H62: Gruntee Womp-R
A63: Chund'r | B63: Tribeless Ligz-r | D63: Yggdrazil | E63: Fanatik Gu Ligz-r | G63: Qog'Na | H63: Gruntee Womp-R
A64: Thorqu'shara | B64: Tribeless Ligz-r
A65: Vvar'Uzgromme | B65: Tribeless Ligz-R | D65: Specialties | E65: Rank | G65: Druoghsha | H65: Gruntee Zult-R
A66: Frug'Kog | B66: Tribeless Wa'K'igg-R | D66: Ugruk Elder | E66: Elder Nob | G66: Gron'teg | H66: Gruntee Zult-R
A67: Glok'tur | B67: Tribeless Kigg-R | D67: Nar'Guula | E67: Blud Kult-R | G67: Kruug | H67: Gruntee Zult-R
A68: Grok'ig | B68: Tribeless Kigg-R | D68: Ka'Blud | E68: Mojoka | G68: Brugutagh | H68: Gruntee Zult-R
A69: Buurz'Sarfu | B69: Tribeless K'igg-R | D69: NefNef | E69: Colv's Prentiss | G69: Knut'rok | H69: Gruntee Zult-R
A70: Xur | B70: Tribeless K'igg-R | D70: Chi'Gar | E70: Tribeless Mojoka | G70: Kreka'or | H70: Gruntee Zult-R
A71: Fal'ua | B71: Tribeless Ug'Lusk-R | D71: Nekruk | E71: Tribeless Mojoka | G71: Ku'Buk | H71: Gruntee Zult-R
A72: Gurduk | B72: Tribeless Gu'Lusk-R | D72: Blug'Plagz | E72: Mojokii | G72: Rag'rabu | H72: Gruntee Zult-R
A73: Skar'lusk | B73: Tribeless Lusk-R | D73: Shistrag | E73: Kulthu | G73: Wuz'Rug | H73: Gruntee Zult-R
A74: Mor'Ghuul | B74: Tribeless Lusk-R | D74: Malkuth | E74: Kult-R
A75: Rik'Ug | B75: Tribeless Lusk-R | D75: Grob | E75: Buorca Stij-r
A76: Grulg'dush | B76: Tribeless Lusk-R | D76: K'Chomp | E76: Tala Butch-r
A77: Tug'nuut | B77: Tribeless Womp-r | D77: Hvark | E77: Nubkuu Mak-r
A78: Garlar | B78: Tribeless Womp-R | D78: Igg'Shahk | E78: Bang'r Mak-R
A79: Guthak'kur | B79: Tribeless Gu'Zult-R | D79: Kabu'fulag | E79: Lil Wuud Kutt-r
A80: Bruz'aa | B80: Tribeless Zult-R | D80: Khug'latz | E80: Nubkuu Butch-r
A81: Glosh'Oorg | B81: Tribeless Zult-R | D81: Kragnagh | E81: Nubkuu Kuuk-r
A82: Vrunk | B82: Tribeless Zult-R | D82: Parga'wuz | E82: Nubkuu Stij-r Mak'R

A1: Historical | B1: APR06 | C1: AUG18 | D1: DEC31
A2: Moonies | B2: 18 | C2: 25 | D2: 26
A3: Ghaashies | B3: 18 | C3: 19 | D3: 19
A4: Howlurs | B4: 19 | C4: 18 | D4: 13
A5: Quatties | B5: 20 | C5: 24 | D5: 21
A6: Shrinkus | B6: 13 | C6: 15 | D6: 13
A7: Biturs | B7: 17 | C7: 22 | D7: 19
A9: Tribeless | B9: 25 | C9: 23 | D9: 21
A10: Specialties | B10: 19 | C10: 19 | D10: 17
A11: Gruntees | B11: 100 | C11: 82 | D11: 68
A13: Tribed | B13: =SUM(B2:B7) -> 105 | C13: =SUM(C2:C7) -> 123 | D13: =SUM(D2:D7) -> 111
A14: Un-tribed | B14: =SUM(B9:B11) -> 144 | C14: =SUM(C9:C11) -> 124 | D14: =SUM(D9:D11) -> 106
A15: Totals | B15: =SUM(B13:B14) -> 249 | C15: =SUM(C13:C14) -> 247 | D15: =SUM(D13:D14) -> 217
A17: Tribed Avg. | B17: =AVERAGE(B2:B7) -> 17.5 | C17: =AVERAGE(C2:C7) -> 20.5 | D17: =AVERAGE(D2:D7) -> 18.5
A18: Tribed % | B18: =B13/B15 -> 0.42168674698795183 | C18: =C13/C15 -> 0.49797570850202427 | D18: =D13/D15 -> 0.51152073732718895